<?xml version="1.0" encoding="UTF-8"?>
<actions xmlns="stendhal" xmlns:xsi="http://www.w3.org/2001/XMLSchema-instance"
	xsi:schemaLocation="stendhal ../actions.xsd ">
	<action name="remove">
		<implementation class-name="games.stendhal.client.DefaultAction"/>
        <type value="remove"/>
		<param key="target" index="0" />
		<number_of_parameters>
			<minimum value="1" />
			<maximum value="1" />
		</number_of_parameters>
	</action>
</actions>