<?xml version="1.0" encoding="UTF-8"?>
<actions xmlns="stendhal" xmlns:xsi="http://www.w3.org/2001/XMLSchema-instance"
	xsi:schemaLocation="stendhal ../actions.xsd ">
	
	<action name="emote">
		<implementation class-name="games.stendhal.client.actions.DefaultAction"/>
		<type value="emote"/>
		<remainder key="text" canBeEmpty="false" />			
		<number_of_parameters>
			<minimum value="0" />
			<maximum value="0" />
		</number_of_parameters>
	</action>
	
	<action name="tell">
		<implementation class-name="games.stendhal.client.actions.DefaultAction"/>
		<type value="tell"/>
        <param key="target" index="0" />
		<remainder key="text" canBeEmpty="false"/>
		<number_of_parameters>
			<minimum value="1" />
			<maximum value="1" />
		</number_of_parameters>
	</action>
	
	<action name="remove">
		<implementation class-name="games.stendhal.client.DefaultAction"/>
        <type value="remove"/>
		<param key="target" index="0" />
		<number_of_parameters>
			<minimum value="1" />
			<maximum value="1" />
		</number_of_parameters>
	</action>
	
	<action name="sentence">
		<implementation class-name="games.stendhal.client.actions.DefaultAction"/>
		<type value="sentence"/>
		<remainder key="value" canBeEmpty="true" />
		<number_of_parameters>
			<minimum value="0" />
			<maximum value="0" />
		</number_of_parameters>
	</action>
	
	<action name="storemessage">
		<implementation class-name="games.stendhal.client.actions.DefaultAction"/>
		<type value="storemessage"/>
		<param key="target" index="0" />
		<remainder key="text" canBeEmpty="false" />
		<number_of_parameters>
			<minimum value="1" />
			<maximum value="1" />
		</number_of_parameters>
	</action>
	
</actions>