<?xml version="1.0" encoding="UTF-8"?>
<actions xmlns="stendhal" xmlns:xsi="http://www.w3.org/2001/XMLSchema-instance"
	xsi:schemaLocation="stendhal ../actions.xsd ">
	
	<action name="groupmanagement">
		<implementation class-name="games.stendhal.client.actions.DefaultAction"/>
		<type value="groupmanagement"/>
        <param key="action" index="0" />
		<remainder key="params" canBeEmpty="false" />
		<number_of_parameters>
			<minimum value="1" />
			<maximum value="1" />
		</number_of_parameters>
	</action>
	
	<action name="group_message">
		<implementation class-name="games.stendhal.client.actions.DefaultAction"/>
		<type value="group_message"/>
		<remainder key="text" canBeEmpty="false" />
		<number_of_parameters>
			<minimum value="0" />
			<maximum value="0" />
		</number_of_parameters>
	</action>
	
</actions>